{
  "schema_version": "1.0",
  "date": "2026-04-08",
  "run_type": "delta",
  "baseline_date": null,
  "regime": {
    "label": "Unknown",
    "bias": "Unknown",
    "conviction": "Medium",
    "summary": ""
  },
  "positions": [],
  "theses": [],
  "market_data": {
    "SPY": 659.22,
    "VIX": 27.0,
    "DXY": 98.84,
    "WTI": 15.0,
    "Gold": 2026.0,
    "BTC": 71600.0,
    "US10Y": 4.36
  },
  "segment_biases": {
    "macro": "",
    "bonds": "",
    "commodities": "Bias",
    "crypto": "F"
  },
  "actionable": [],
  "risks": [],
  "portfolio_posture": "Defensive",
  "cash_pct": 75.0
}